{
  "$schema": "https://json-schema.org/draft/2020-12/schema",
  "type": "object",
  "required": ["schema_version", "task_id", "symptom", "root_cause", "status", "evidence"],
  "properties": {
    "schema_version": {"type": "integer", "enum": [2]},
    "task_id": {"type": "string", "minLength": 1},
    "symptom": {"type": "string", "minLength": 1},
    "root_cause": {"type": "string", "minLength": 1},
    "status": {"type": "string", "enum": ["CONFIRMED", "UNCONFIRMED", "BLOCKED"]},
    "evidence": {
      "type": "array",
      "minItems": 1,
      "items": {
        "type": "object",
        "required": ["observation"],
        "properties": {
          "path": {"type": "string", "minLength": 1},
          "command": {"type": "string", "minLength": 1},
          "observation": {"type": "string", "minLength": 1}
        },
        "additionalProperties": false
      }
    },
    "rejected_hypotheses": {
      "type": "array",
      "items": {"type": "string", "minLength": 1}
    }
  },
  "additionalProperties": false
}
