{
  "schema_version": 2,
  "task_id": "BUG-1",
  "symptom": "Expected output is missing",
  "root_cause": "A guard rejects a valid empty collection",
  "status": "CONFIRMED",
  "evidence": [
    {
      "path": "src/module.py",
      "observation": "guard uses truthiness instead of explicit absence"
    }
  ]
}
